Item,Quantity,Description,Unit Price (USD Approx.),Purchase Link
Raspberry Pi 5 (8GB),1,Latest flagship board with high performance,$120,https://www.raspberrypi.com/products/raspberry-pi-5/
IMX462 Starvis All-Sky Cam,1,Outstanding low-light astrophotography camera,$120,https://www.aliexpress.com/item/1005004258249394.html
Compact Automatic Satellite Dish,1,Small, vehicle-friendly auto-tracking dish,$130,https://www.alibaba.com/showroom/auto-satellite-dish.html
Ublox NEO-6M GPS Module,1,Popular hobby GPS with stable performance,$15,https://www.amazon.com/dp/B01MTU9KDM
MG995 Servo Motor (Full metal gear),4,Robust, high-torque servos, $6 each ($24 total),https://www.amazon.com/s?k=mg995+servo
LDR (Light Dependent Resistor, pack),1,Standard 5mm LDRs (10-pack),$7,https://www.amazon.com/dp/B07QK4XR98
Project wiring/connectors/dupont kit,1,Assorted wires, jumper packs, tools,$15,https://www.amazon.com/s?k=jumper+wires+kit